{
  "title": "Mock Protocol for testing CHA bluetooth interface",
  "subtitle": "Gets used in unit testing.<br />For demonstration purposes only.",
  "instructionText": "Follow the instructions given for each exam.",
  "helpText": "Follow the instructions given for each exam.",
  "headset": "WAHTS",
  "pages": [
    {
      "id": "ToneGeneration1",
      "title": "Tone Generation 3",
      "questionMainText": "Generating Tones",
      "responseArea":{
        "type": "chaToneGeneration",
        "examProperties":{
          "F": 8000,
          "OutputChannel": "HPL0",
          "ToneDuration":3000
        }
      }
    }
  ]
}
